{
  "schemaVersion": "soulscrape.person-index.v1",
  "indexId": "pidx-hraness-core-automation",
  "generatedAt": "2026-10-05T02:12:14.100Z",
  "subject": {
    "kind": "organization",
    "handle": "core-automation",
    "displayName": "core automation",
    "summary": "a sourced history of core automation, inc., the san francisco ai lab founded by former openai vp of research jerry tworek, not the industrial-automation firms."
  },
  "scope": {
    "asOf": "2026-10-05T02:12:14.100Z",
    "coverage": [
      "hraness-dossier"
    ]
  },
  "sources": [
    {
      "id": "source-3aa359c7d56ee6f22e67",
      "binding": "archive",
      "mediaType": "webpage",
      "title": "core automation - Hraness dossier",
      "url": "https://hraness.com/core-automation",
      "publisher": "Hraness",
      "accessedAt": "2026-10-05T02:12:14.100Z",
      "notes": "Original public Hraness dossier imported into Soulscrape sections."
    }
  ],
  "claims": [
    {
      "id": "claim-hraness-dossier",
      "kind": "fact",
      "text": "Hraness published a sourced dossier about core automation at https://hraness.com/core-automation.",
      "sourceIds": [
        "source-3aa359c7d56ee6f22e67"
      ]
    }
  ],
  "body": "# core automation\n\na sourced history of core automation, inc., the san francisco ai lab founded by former openai vp of research jerry tworek, not the industrial-automation firms.\n\ncore automation is the san francisco lab jerry tworek founded after seven years running openai's reasoning program — the rubik's-cube hand, codex, o1, o3, gpt-5 — because the research he wanted to do was 'hard to do at openai.' it launched april 21, 2026 with a coordinated 'nerdsniped' cofounder reveal and a reported ~$100m safe round at ~$1b; six weeks later the information had it seeking $300m–$500m at ~$4b, and by july 30 a form d showed $635.2m authorized and $432.1m sold to 51 investors — all before shipping a product, because the product is the lab: 'the world's most automated ai lab,' betting that transformers can't learn continually and a ~20-person team running agents can find what replaces them. this is the record of that bet — the launch, the messy ledger, the competition, the internship, and the gaps.\n\n- [history](https://hraness.com/core-automation/history): the company, sourced and dated — the openai years, the january exit, the april launch, the round that kept changing, and the lab in public.\n  - [the openai years](https://hraness.com/core-automation/history#prehistory): amsterdam quant finance, then seven years at openai — the rubik's-cube hand, codex, humaneval, and the q*/strawberry line that became o1, o3, and gpt-5.\n  - [the exit and the founding](https://hraness.com/core-automation/history#departure): the january 5 exit post, the core memory interview, the information naming the company, and a late-march incorporation.\n  - [the launch](https://hraness.com/core-automation/history#launch): the reported ~$100m safe round at ~$1b, the april 21 launch, and the coordinated 'nerdsniped' cofounder reveal.\n  - [the round that kept changing](https://hraness.com/core-automation/history#round): the reported $300m–$500m seek at ~$4b, then the july 30 form d: $635.2m authorized, $432.1m sold to 51 investors, $135.3m of converted safes.\n  - [the lab in public](https://hraness.com/core-automation/history#operating): the blog corpus, the agi house keynote, the sequoia and mts episodes, one layer deeper, and the agm internship.\n- [people](https://hraness.com/core-automation/people): tworek and the team he nerdsniped — who they are, what they wrote and said, and which identities stay flagged.\n  - [the founder](https://hraness.com/core-automation/people#founder): jerry tworek — quant trader, openai vp of research, and the self-authored record at millionintegrals.\n  - [the cofounders](https://hraness.com/core-automation/people#cofounders): anil, jang, villagra, gulati, lamp, saroufim, garg, patil — the launch-day reveal and the biographies behind it.\n  - [the bench](https://hraness.com/core-automation/people#bench): amid, duvvuri, rosenthal, the wider bench, and the inferred backers — the layer around the cofounders.\n  - [the writing](https://hraness.com/core-automation/people#writing): the self-authored corpus — the homepage, the launch posts, the blog, the reservoir samples.\n  - [interviews and talks](https://hraness.com/core-automation/people#appearances): core memory, training data, the information bottleneck, mts, agi house — where the thesis got said out loud.\n  - [the open flags](https://hraness.com/core-automation/people#flags): the roster questions that stay open — self-applied titles, the patil name match, the adept attribution, the inferred cap table.\n  - [the philosophy](https://hraness.com/core-automation/people#philosophy): continual learning, evals are dead, small teams with capable agents, and the automated lab.\n- [side quests](https://hraness.com/core-automation/side-quests): the pursuits around the company — the founders' earlier work, the competition and the internship, and the neo-lab ecosystem.\n  - [the founders' earlier work](https://hraness.com/core-automation/side-quests#founders): the quant years, the shampoo→psgd line, project mariner, openai labs, gpu mode, mosaicml composer, reservoir samples, fysk.\n  - [the company's quests](https://hraness.com/core-automation/side-quests#company): the blog corpus, one layer deeper, the agm program, and the pacing letter the lab's employees signed.\n  - [the ecosystem](https://hraness.com/core-automation/side-quests#ecosystem): tilde research, the alumni ventures feeder, and the neo-lab cohort the company gets grouped with.\n- [coverage](https://hraness.com/core-automation/coverage): what the discourse made of core automation — the departure press, the talent-shock launch, the funding ledger, and the thin controversy file.\n  - [the departure](https://hraness.com/core-automation/coverage#departure): the verge, the decoder's 'not-so-subtle dig,' and the 'major loss for openai' reads of the january exit.\n  - [the launch](https://hraness.com/core-automation/coverage#launch): the nerdsniped coverage wave — bi's signature story, the neo-lab mapping, and a hacker news submission that sat at 1 point.\n  - [the funding](https://hraness.com/core-automation/coverage#funding): the $4b seek, the form d reads, and the tracker arithmetic — deal-flow astonishment plus the first skepticism.\n  - [the founder media](https://hraness.com/core-automation/coverage#founder-media): the podcast circuit and the showcase profile — the founders' own channels carrying most of the technical record.\n  - [the discourse](https://hraness.com/core-automation/coverage#discourse): the skeptics, the deepest secondary analysis, and the one hn thread that actually debated the company.\n  - [controversies](https://hraness.com/core-automation/coverage#controversies): the unreconciled ledger, the talent-raid frame, the vaporware file, the namesakes, the pacing wrinkle, and the self-reported layer.\n  - [sentiment eras](https://hraness.com/core-automation/coverage#eras): sentiment phases: departure intrigue → talent-shock launch → money velocity → substantive evaluation → operationalization.\n- [the idea](https://hraness.com/core-automation/the-idea): the automated lab as the product — the lineage core automation inherited, what it has and hasn't shown, and what agents do to the argument.\n  - [lineage](https://hraness.com/core-automation/the-idea#lineage): the reasoning program, the optimizer line, the product-and-people bench, the automated-science wave, and the continual-learning problem.\n  - [what it showed](https://hraness.com/core-automation/the-idea#proved): talent gravity, capital before product, the competition as instrument, and the legible lab.\n  - [what stayed unproven](https://hraness.com/core-automation/the-idea#stalled): no product, continual learning unproven, self-reported automation claims, and the second-hand 'ceres.'\n  - [the agent-era arguments](https://hraness.com/core-automation/the-idea#agent-era): the for/against/nuance ledger — contestable exploration, the flywheel, the bitter-lesson trap, the taste problem, the verification gap.\n  - [successors](https://hraness.com/core-automation/the-idea#successors): openai's own automation program, the neolab cohort, sakana, tilde — competitors, cohort-mates, and the one collaborator.\n  - [open questions](https://hraness.com/core-automation/the-idea#open-questions): the questions the next chapter has to answer.\n- [sources](https://hraness.com/core-automation/sources): every source cited in the core automation history, with its date and type.\n  - [the catalog](https://hraness.com/core-automation/sources#catalog): the full typed catalog — primary, interview, reporting, archive, community, reference, repo.\n- [method](https://hraness.com/core-automation/method): how ai agents researched the core automation history, the evidence rules they followed, and what they could not verify.\n  - [the lanes](https://hraness.com/core-automation/method#lanes): the two parallel research lanes and what the formula proved.\n  - [the evidence rules](https://hraness.com/core-automation/method#rules): the evidence model — confidence, precision, sentiment discipline.\n  - [known gaps](https://hraness.com/core-automation/method#gaps): what the research could not verify — recorded, not hidden.\n  - [corrections](https://hraness.com/core-automation/method#corrections): how to correct the record.\n\nAI-drafted at Ben Guo's direct request and credited to Hraness; every claim links to its cataloged source.\n\nCanonical page: https://hraness.com/core-automation\n",
  "provenance": {
    "tool": "hraness-dossier-export",
    "method": "public-person-index-v2",
    "contributors": [
      "Hraness"
    ]
  }
}
